{"$schema":"https://json-schema.org/draft/2020-12/schema","$id":"pipeline.backlog-reconciliation-receipt.v1","type":"object","additionalProperties":false,"required":["schema","receiptId","intentId","idempotencyKey","intentSha256","status","preSnapshot","postSnapshot","targets","eventSequences","appliedAt","recordSha256"],"properties":{"schema":{"const":"pipeline.backlog-reconciliation-receipt.v1"},"receiptId":{"type":"string","pattern":"^[a-f0-9]{64}$"},"intentId":{"type":"string","maxLength":128},"idempotencyKey":{"type":"string","pattern":"^[a-f0-9]{64}$"},"intentSha256":{"type":"string","pattern":"^[a-f0-9]{64}$"},"status":{"const":"applied"},"preSnapshot":{"$ref":"#/$defs/snapshot"},"postSnapshot":{"$ref":"#/$defs/snapshot"},"targets":{"type":"array","items":{"$ref":"#/$defs/target"}},"eventSequences":{"type":"array","items":{"type":"integer"}},"appliedAt":{"type":"string","pattern":"^\\d{4}-\\d{2}-\\d{2}T\\d{2}:\\d{2}:\\d{2}\\.\\d{3}Z$"},"recordSha256":{"type":"string","pattern":"^[a-f0-9]{64}$"}},"$defs":{"snapshot":{"type":"object","additionalProperties":false,"required":["commit","tree","backlogSubtree","ledgerHead","indexFileSha256","statusFileSha256","itemFileSha256"],"properties":{"commit":{"type":"string","pattern":"^[a-f0-9]{40}$"},"tree":{"type":"string","pattern":"^[a-f0-9]{40}$"},"backlogSubtree":{"type":"string","pattern":"^[a-f0-9]{64}$"},"ledgerHead":{"type":"string","pattern":"^[a-f0-9]{64}$"},"indexFileSha256":{"type":"string","pattern":"^[a-f0-9]{64}$"},"statusFileSha256":{"type":"string","pattern":"^[a-f0-9]{64}$"},"itemFileSha256":{"type":"array","items":{"$ref":"#/$defs/itemDigest"}}}},"itemDigest":{"type":"object","additionalProperties":false,"required":["id","sha256"],"properties":{"id":{"type":"string"},"sha256":{"type":"string","pattern":"^[a-f0-9]{64}$"}}},"target":{"type":"object","additionalProperties":false,"required":["path","preSha256","postSha256"],"properties":{"path":{"type":"string"},"preSha256":{"type":"string","pattern":"^[a-f0-9]{64}$"},"postSha256":{"type":"string","pattern":"^[a-f0-9]{64}$"}}}}}
